{
  "$schema": "https://json-schema.org/draft/2020-12/schema",
  "$id": "https://example.org/schemas/automation-plan-v1.json",
  "title": "Deterministic Exception Automation Plan",
  "type": "object",
  "additionalProperties": false,
  "required": ["automation_schema_version", "tenant", "packet", "policy", "findings", "review_now_finding_ids", "deferred_finding_ids", "metrics", "plan_hash"],
  "properties": {
    "automation_schema_version": {"const": "1.0.0"},
    "tenant": {"$ref": "#/$defs/tenant"},
    "packet": {"$ref": "#/$defs/packet"},
    "policy": {"$ref": "#/$defs/policy"},
    "findings": {"type": "array", "items": {"$ref": "#/$defs/findingAutomation"}},
    "review_now_finding_ids": {"$ref": "#/$defs/uniqueStrings"},
    "deferred_finding_ids": {"$ref": "#/$defs/uniqueStrings"},
    "metrics": {"$ref": "#/$defs/metrics"},
    "plan_hash": {"$ref": "#/$defs/digest"}
  },
  "$defs": {
    "nonEmpty": {"type": "string", "minLength": 1},
    "digest": {"type": "string", "pattern": "^[0-9a-f]{64}$"},
    "uniqueStrings": {"type": "array", "uniqueItems": true, "items": {"$ref": "#/$defs/nonEmpty"}},
    "tenant": {
      "type": "object", "additionalProperties": false,
      "required": ["tenant_id", "workspace_id"],
      "properties": {"tenant_id": {"$ref": "#/$defs/nonEmpty"}, "workspace_id": {"$ref": "#/$defs/nonEmpty"}}
    },
    "packet": {
      "type": "object", "additionalProperties": false,
      "required": ["packet_id", "packet_hash", "case_id", "encounter_id"],
      "properties": {
        "packet_id": {"type": "string", "pattern": "^packet-[0-9a-f]{20}$"},
        "packet_hash": {"$ref": "#/$defs/digest"},
        "case_id": {"$ref": "#/$defs/nonEmpty"},
        "encounter_id": {"$ref": "#/$defs/nonEmpty"}
      }
    },
    "policy": {
      "type": "object", "additionalProperties": false,
      "required": ["policy_id", "version", "quick_confirm_confidence", "auto_route_confidence", "auto_route_max_impact_cents", "max_review_cases", "max_review_seconds", "digest"],
      "properties": {
        "policy_id": {"$ref": "#/$defs/nonEmpty"}, "version": {"$ref": "#/$defs/nonEmpty"},
        "quick_confirm_confidence": {"type": "number", "minimum": 0, "maximum": 1},
        "auto_route_confidence": {"type": "number", "minimum": 0, "maximum": 1},
        "auto_route_max_impact_cents": {"type": "integer", "minimum": 1},
        "max_review_cases": {"type": "integer", "minimum": 1},
        "max_review_seconds": {"type": "integer", "minimum": 1},
        "digest": {"$ref": "#/$defs/digest"}
      }
    },
    "findingAutomation": {
      "type": "object", "additionalProperties": false,
      "required": ["automation_id", "finding_id", "finding_hash", "semantic_fingerprint", "tier", "queue", "reason_codes", "recommended_action", "allowed_actions", "draft", "priority_score", "estimated_review_seconds", "duplicate_of", "related_finding_ids"],
      "properties": {
        "automation_id": {"type": "string", "pattern": "^automation-[0-9a-f]{20}$"},
        "finding_id": {"$ref": "#/$defs/nonEmpty"}, "finding_hash": {"$ref": "#/$defs/digest"}, "semantic_fingerprint": {"$ref": "#/$defs/digest"},
        "tier": {"enum": ["suppressed", "needs_enrichment", "auto_routed", "quick_confirm", "focused_review", "escalated"]},
        "queue": {"enum": ["none", "coding", "cdi", "charge", "compliance"]},
        "reason_codes": {"type": "array", "minItems": 1, "uniqueItems": true, "items": {"$ref": "#/$defs/nonEmpty"}},
        "recommended_action": {"type": ["string", "null"]},
        "allowed_actions": {"$ref": "#/$defs/uniqueStrings"},
        "draft": {"type": "object"}, "priority_score": {"type": "integer", "minimum": 0},
        "estimated_review_seconds": {"type": "integer", "minimum": 0},
        "duplicate_of": {"type": ["string", "null"]},
        "related_finding_ids": {"$ref": "#/$defs/uniqueStrings"}
      }
    },
    "metrics": {
      "type": "object", "additionalProperties": false,
      "required": ["input_findings", "consolidated_findings", "review_now", "deferred", "estimated_review_seconds", "suppressed", "needs_enrichment", "auto_routed", "quick_confirm", "focused_review", "escalated"],
      "properties": {
        "input_findings": {"type": "integer", "minimum": 0}, "consolidated_findings": {"type": "integer", "minimum": 0},
        "review_now": {"type": "integer", "minimum": 0}, "deferred": {"type": "integer", "minimum": 0},
        "estimated_review_seconds": {"type": "integer", "minimum": 0},
        "suppressed": {"type": "integer", "minimum": 0}, "needs_enrichment": {"type": "integer", "minimum": 0},
        "auto_routed": {"type": "integer", "minimum": 0}, "quick_confirm": {"type": "integer", "minimum": 0},
        "focused_review": {"type": "integer", "minimum": 0}, "escalated": {"type": "integer", "minimum": 0}
      }
    }
  }
}
